{"description":"Drive Trellis operator RPC workflows from the Rust CLI.","displayName":"Trellis CLI","format":"trellis.contract.v1","id":"trellis.cli@v1","kind":"cli","uses":{"auth":{"contract":"trellis.auth@v1","rpc":{"call":["Auth.InstallService","Auth.ListApprovals","Auth.ListServices","Auth.Logout","Auth.Me","Auth.RenewBindingToken","Auth.RevokeApproval","Auth.UpgradeServiceContract"]}},"core":{"contract":"trellis.core@v1","rpc":{"call":["Trellis.Catalog","Trellis.Contract.Get"]}}}}
