{"description":"Trellis runtime RPCs available to all connected participants.","displayName":"Trellis Core","format":"trellis.contract.v1","id":"trellis.core@v1","kind":"service","rpc":{"Trellis.Bindings.Get":{"capabilities":{"call":["service"]},"errors":[{"type":"ValidationError"},{"type":"UnexpectedError"}],"input":{"schema":"TrellisBindingsGetRequest"},"output":{"schema":"TrellisBindingsGetResponse"},"subject":"rpc.v1.Trellis.Bindings.Get","version":"v1"},"Trellis.Catalog":{"capabilities":{"call":["trellis.catalog.read"]},"errors":[{"type":"ValidationError"},{"type":"UnexpectedError"}],"input":{"schema":"TrellisCatalogRequest"},"output":{"schema":"TrellisCatalogResponse"},"subject":"rpc.v1.Trellis.Catalog","version":"v1"},"Trellis.Contract.Get":{"capabilities":{"call":["trellis.contract.read"]},"errors":[{"type":"ValidationError"},{"type":"UnexpectedError"}],"input":{"schema":"TrellisContractGetRequest"},"output":{"schema":"TrellisContractGetResponse"},"subject":"rpc.v1.Trellis.Contract.Get","version":"v1"}},"schemas":{"TrellisBindingsGetRequest":{"additionalProperties":false,"properties":{"contractId":{"minLength":1,"type":"string"},"digest":{"pattern":"^[A-Za-z0-9_-]+$","type":"string"}},"type":"object"},"TrellisBindingsGetResponse":{"additionalProperties":false,"properties":{"binding":{"additionalProperties":false,"properties":{"contractId":{"minLength":1,"type":"string"},"digest":{"pattern":"^[A-Za-z0-9_-]+$","type":"string"},"resources":{"properties":{"jobs":{"additionalProperties":false,"properties":{"namespace":{"minLength":1,"type":"string"},"queues":{"patternProperties":{"^.*$":{"additionalProperties":false,"properties":{"ackWaitMs":{"minimum":1,"type":"integer"},"backoffMs":{"items":{"minimum":0,"type":"integer"},"type":"array"},"concurrency":{"minimum":1,"type":"integer"},"consumerName":{"minLength":1,"type":"string"},"defaultDeadlineMs":{"minimum":1,"type":"integer"},"dlq":{"type":"boolean"},"logs":{"type":"boolean"},"maxDeliver":{"minimum":1,"type":"integer"},"payload":{"additionalProperties":false,"properties":{"schema":{"minLength":1,"type":"string"}},"required":["schema"],"type":"object"},"progress":{"type":"boolean"},"publishPrefix":{"minLength":1,"type":"string"},"queueType":{"minLength":1,"type":"string"},"result":{"additionalProperties":false,"properties":{"schema":{"minLength":1,"type":"string"}},"required":["schema"],"type":"object"},"workSubject":{"minLength":1,"type":"string"}},"required":["queueType","publishPrefix","workSubject","consumerName","payload","maxDeliver","backoffMs","ackWaitMs","progress","logs","dlq","concurrency"],"type":"object"}},"type":"object"},"registry":{"additionalProperties":false,"properties":{"bucket":{"minLength":1,"type":"string"}},"required":["bucket"],"type":"object"}},"required":["namespace","queues"],"type":"object"},"kv":{"patternProperties":{"^.*$":{"additionalProperties":false,"properties":{"bucket":{"minLength":1,"type":"string"},"history":{"minimum":1,"type":"integer"},"maxValueBytes":{"minimum":1,"type":"integer"},"ttlMs":{"minimum":0,"type":"integer"}},"required":["bucket","history","ttlMs"],"type":"object"}},"type":"object"}},"type":"object"}},"required":["contractId","digest","resources"],"type":"object"}},"type":"object"},"TrellisCatalogRequest":{"additionalProperties":false,"properties":{},"type":"object"},"TrellisCatalogResponse":{"additionalProperties":false,"properties":{"catalog":{"additionalProperties":false,"properties":{"contracts":{"items":{"additionalProperties":false,"properties":{"description":{"minLength":1,"type":"string"},"digest":{"type":"string"},"displayName":{"minLength":1,"type":"string"},"id":{"type":"string"},"kind":{"minLength":1,"type":"string"}},"required":["id","digest","displayName","description","kind"],"type":"object"},"type":"array"},"format":{"const":"trellis.catalog.v1","type":"string"}},"required":["format","contracts"],"type":"object"}},"required":["catalog"],"type":"object"},"TrellisContractGetRequest":{"additionalProperties":false,"properties":{"digest":{"pattern":"^[A-Za-z0-9_-]+$","type":"string"}},"required":["digest"],"type":"object"},"TrellisContractGetResponse":{"additionalProperties":false,"properties":{"contract":{"properties":{"description":{"minLength":1,"type":"string"},"displayName":{"minLength":1,"type":"string"},"errors":{"patternProperties":{"^.*$":{"type":"object"}},"type":"object"},"events":{"patternProperties":{"^.*$":{"type":"object"}},"type":"object"},"format":{"const":"trellis.contract.v1","type":"string"},"id":{"minLength":1,"type":"string"},"kind":{"minLength":1,"type":"string"},"resources":{"properties":{"jobs":{"additionalProperties":false,"properties":{"queues":{"patternProperties":{"^.*$":{"additionalProperties":false,"properties":{"ackWaitMs":{"minimum":1,"type":"integer"},"backoffMs":{"items":{"minimum":0,"type":"integer"},"type":"array"},"concurrency":{"minimum":1,"type":"integer"},"defaultDeadlineMs":{"minimum":1,"type":"integer"},"dlq":{"type":"boolean"},"logs":{"type":"boolean"},"maxDeliver":{"minimum":1,"type":"integer"},"payload":{"additionalProperties":false,"properties":{"schema":{"minLength":1,"type":"string"}},"required":["schema"],"type":"object"},"progress":{"type":"boolean"},"result":{"additionalProperties":false,"properties":{"schema":{"minLength":1,"type":"string"}},"required":["schema"],"type":"object"}},"required":["payload"],"type":"object"}},"type":"object"}},"required":["queues"],"type":"object"},"kv":{"patternProperties":{"^.*$":{"additionalProperties":false,"properties":{"history":{"default":1,"minimum":1,"type":"integer"},"maxValueBytes":{"minimum":1,"type":"integer"},"purpose":{"minLength":1,"type":"string"},"required":{"default":true,"type":"boolean"},"ttlMs":{"default":0,"minimum":0,"type":"integer"}},"required":["purpose"],"type":"object"}},"type":"object"}},"type":"object"},"rpc":{"patternProperties":{"^.*$":{"type":"object"}},"type":"object"},"schemas":{"patternProperties":{"^.*$":{"anyOf":[{"type":"object"},{"type":"boolean"}]}},"type":"object"},"subjects":{"patternProperties":{"^.*$":{"type":"object"}},"type":"object"},"uses":{"patternProperties":{"^.*$":{"type":"object"}},"type":"object"}},"required":["format","id","displayName","description","kind"],"type":"object"}},"required":["contract"],"type":"object"}}}
